{"$schema":"https://json-schema.org/draft/2020-12/schema","title":"Marketing Research Report Data","type":"object","required":["meta","executive_summary","methodology","market","trends","competitors","audiences","swot","business_model_canvas","roadmap","sources"],"properties":{"meta":{"type":"object","required":["project_name","research_date","geography"],"properties":{"project_name":{"type":"string"},"subtitle":{"type":"string"},"research_date":{"type":"string"},"geography":{"type":"string"},"business_type":{"type":"string"},"data_confidence":{"type":"string","enum":["high","medium","low","mixed"]}}},"executive_summary":{"type":"object","properties":{"overview":{"type":"string"},"key_findings":{"type":"array","items":{"type":"string"}},"priority_actions":{"type":"array","items":{"type":"string"}},"metrics":{"type":"array","items":{"$ref":"#/$defs/metric"}}}},"methodology":{"type":"object","properties":{"scope":{"type":"string"},"methods":{"type":"array","items":{"type":"string"}},"limitations":{"type":"array","items":{"type":"string"}},"confidence_note":{"type":"string"}}},"market":{"type":"object","properties":{"definition":{"type":"string"},"structure":{"type":"array","items":{"type":"string"}},"drivers":{"type":"array","items":{"type":"string"}},"barriers":{"type":"array","items":{"type":"string"}},"seasonality":{"type":"string"},"market_size":{"type":"object","properties":{"currency":{"type":"string"},"period":{"type":"string"},"tam":{"$ref":"#/$defs/market_level"},"sam":{"$ref":"#/$defs/market_level"},"som":{"$ref":"#/$defs/market_level"},"scenarios":{"type":"array","items":{"$ref":"#/$defs/scenario"}}}},"pestel":{"type":"array","items":{"$ref":"#/$defs/labeled_list"}},"porter":{"type":"array","items":{"$ref":"#/$defs/labeled_list"}}}},"trends":{"type":"array","items":{"$ref":"#/$defs/trend"}},"competitors":{"type":"object","properties":{"summary":{"type":"string"},"items":{"type":"array","items":{"$ref":"#/$defs/competitor"}},"white_spaces":{"type":"array","items":{"type":"string"}}}},"audiences":{"type":"array","items":{"$ref":"#/$defs/audience"}},"cjm":{"type":"array","items":{"$ref":"#/$defs/cjm_stage"}},"value_proposition":{"type":"object","properties":{"customer_jobs":{"type":"array","items":{"type":"string"}},"pains":{"type":"array","items":{"type":"string"}},"gains":{"type":"array","items":{"type":"string"}},"products_services":{"type":"array","items":{"type":"string"}},"pain_relievers":{"type":"array","items":{"type":"string"}},"gain_creators":{"type":"array","items":{"type":"string"}}}},"positioning":{"type":"object","properties":{"statement":{"type":"string"},"category":{"type":"string"},"target_segment":{"type":"string"},"core_value":{"type":"string"},"differentiation":{"type":"string"},"proof":{"type":"array","items":{"type":"string"}},"messages":{"type":"array","items":{"type":"string"}}}},"swot":{"type":"object","required":["strengths","weaknesses","opportunities","threats"],"properties":{"strengths":{"type":"array","items":{"type":"string"}},"weaknesses":{"type":"array","items":{"type":"string"}},"opportunities":{"type":"array","items":{"type":"string"}},"threats":{"type":"array","items":{"type":"string"}},"strategies":{"type":"object","properties":{"so":{"type":"array","items":{"type":"string"}},"wo":{"type":"array","items":{"type":"string"}},"st":{"type":"array","items":{"type":"string"}},"wt":{"type":"array","items":{"type":"string"}}}}}},"business_model_canvas":{"type":"object","required":["customer_segments","value_propositions","channels","customer_relationships","revenue_streams","key_resources","key_activities","key_partners","cost_structure"],"properties":{"customer_segments":{"type":"array","items":{"type":"string"}},"value_propositions":{"type":"array","items":{"type":"string"}},"channels":{"type":"array","items":{"type":"string"}},"customer_relationships":{"type":"array","items":{"type":"string"}},"revenue_streams":{"type":"array","items":{"type":"string"}},"key_resources":{"type":"array","items":{"type":"string"}},"key_activities":{"type":"array","items":{"type":"string"}},"key_partners":{"type":"array","items":{"type":"string"}},"cost_structure":{"type":"array","items":{"type":"string"}}}},"marketing_sales":{"type":"object","properties":{"channels":{"type":"array","items":{"$ref":"#/$defs/channel"}},"offers":{"type":"array","items":{"type":"string"}},"content_directions":{"type":"array","items":{"type":"string"}},"hypotheses":{"type":"array","items":{"$ref":"#/$defs/hypothesis"}}}},"roadmap":{"type":"object","required":["days_30","days_60","days_90"],"properties":{"days_30":{"type":"array","items":{"$ref":"#/$defs/action"}},"days_60":{"type":"array","items":{"$ref":"#/$defs/action"}},"days_90":{"type":"array","items":{"$ref":"#/$defs/action"}}}},"assumptions_gaps":{"type":"object","properties":{"assumptions":{"type":"array","items":{"type":"string"}},"contradictions":{"type":"array","items":{"type":"string"}},"missing_data":{"type":"array","items":{"type":"string"}},"risks":{"type":"array","items":{"type":"string"}}}},"sources":{"type":"array","items":{"$ref":"#/$defs/source"}}},"$defs":{"metric":{"type":"object","required":["label","value"],"properties":{"label":{"type":"string"},"value":{"type":"string"},"note":{"type":"string"}}},"market_level":{"type":"object","properties":{"value":{"type":["number","string"]},"label":{"type":"string"},"formula":{"type":"string"},"assumptions":{"type":"array","items":{"type":"string"}},"source_ids":{"type":"array","items":{"type":"string"}}}},"scenario":{"type":"object","properties":{"name":{"type":"string"},"tam":{"type":["number","string"]},"sam":{"type":["number","string"]},"som":{"type":["number","string"]},"assumptions":{"type":"array","items":{"type":"string"}}}},"labeled_list":{"type":"object","properties":{"label":{"type":"string"},"items":{"type":"array","items":{"type":"string"}}}},"trend":{"type":"object","required":["name","direction"],"properties":{"name":{"type":"string"},"direction":{"type":"string","enum":["up","stable","down"]},"description":{"type":"string"},"impact":{"type":"string"},"horizon":{"type":"string"},"source_ids":{"type":"array","items":{"type":"string"}}}},"competitor":{"type":"object","required":["name","type"],"properties":{"name":{"type":"string"},"type":{"type":"string"},"website":{"type":"string"},"product":{"type":"string"},"price":{"type":"string"},"offer":{"type":"string"},"positioning":{"type":"string"},"strengths":{"type":"array","items":{"type":"string"}},"weaknesses":{"type":"array","items":{"type":"string"}},"channels":{"type":"array","items":{"type":"string"}},"source_ids":{"type":"array","items":{"type":"string"}}}},"audience":{"type":"object","required":["name","priority"],"properties":{"name":{"type":"string"},"priority":{"type":"string","enum":["high","medium","low"]},"description":{"type":"string"},"situation":{"type":"string"},"jtbd":{"type":"string"},"pains":{"type":"array","items":{"type":"string"}},"motives":{"type":"array","items":{"type":"string"}},"triggers":{"type":"array","items":{"type":"string"}},"barriers":{"type":"array","items":{"type":"string"}},"criteria":{"type":"array","items":{"type":"string"}},"decision_roles":{"type":"array","items":{"type":"string"}},"channels":{"type":"array","items":{"type":"string"}}}},"cjm_stage":{"type":"object","properties":{"stage":{"type":"string"},"actions":{"type":"array","items":{"type":"string"}},"questions":{"type":"array","items":{"type":"string"}},"barriers":{"type":"array","items":{"type":"string"}},"touchpoints":{"type":"array","items":{"type":"string"}},"opportunities":{"type":"array","items":{"type":"string"}}}},"channel":{"type":"object","properties":{"name":{"type":"string"},"segment":{"type":"string"},"priority":{"type":"string"},"speed":{"type":"string"},"cost":{"type":"string"},"lead_quality":{"type":"string"},"rationale":{"type":"string"}}},"hypothesis":{"type":"object","properties":{"hypothesis":{"type":"string"},"basis":{"type":"string"},"test":{"type":"string"},"metric":{"type":"string"},"success_criterion":{"type":"string"},"priority":{"type":"string"}}},"action":{"type":"object","required":["action"],"properties":{"action":{"type":"string"},"reason":{"type":"string"},"metric":{"type":"string"},"owner":{"type":"string"},"resources":{"type":"string"},"priority":{"type":"string"}}},"source":{"type":"object","required":["id","title","url"],"properties":{"id":{"type":"string"},"title":{"type":"string"},"organization":{"type":"string"},"url":{"type":"string"},"published_at":{"type":"string"},"accessed_at":{"type":"string"},"geography":{"type":"string"},"supports":{"type":"array","items":{"type":"string"}},"reliability":{"type":"string","enum":["high","medium","low"]}}}}}