{
  "meta": {
    "project_name": "Пример проекта",
    "subtitle": "Демонстрационное маркетинговое исследование",
    "research_date": "2026-06-09",
    "geography": "Санкт-Петербург",
    "business_type": "B2B / B2C",
    "data_confidence": "mixed"
  },
  "executive_summary": {
    "overview": "Демонстрационный набор данных для проверки интерфейса отчёта.",
    "key_findings": [
      "Рынок фрагментирован, а стандарты сервиса различаются.",
      "Приоритетный сегмент ценит снижение рисков и прозрачность процесса.",
      "Основной резерв роста связан с доказательствами и партнёрскими каналами."
    ],
    "priority_actions": [
      "Упаковать кейсы и измеримые доказательства.",
      "Сформировать отдельный оффер для приоритетного сегмента.",
      "Запустить тест партнёрского канала."
    ],
    "metrics": [
      {"label": "TAM", "value": "12,4 млрд ₽", "note": "Базовый сценарий"},
      {"label": "SAM", "value": "2,1 млрд ₽", "note": "Целевая география"},
      {"label": "SOM", "value": "48 млн ₽", "note": "Горизонт 3 года"},
      {"label": "Приоритетный сегмент", "value": "Сегмент A", "note": "Высокий приоритет"}
    ]
  },
  "methodology": {
    "scope": "Открытые источники и данные брифа.",
    "methods": ["Кабинетное исследование", "Анализ конкурентов", "Сценарная оценка рынка"],
    "limitations": ["Часть показателей рассчитана по допущениям"],
    "confidence_note": "Уровень уверенности различается по разделам."
  },
  "market": {
    "definition": "Демонстрационное определение продуктовых и географических границ рынка.",
    "structure": ["Основной сегмент", "Смежный сегмент"],
    "drivers": ["Рост спроса на комплексные решения", "Повышение требований к срокам"],
    "barriers": ["Недоверие", "Длинный цикл сделки", "Низкая стандартизация"],
    "seasonality": "Умеренная сезонность.",
    "market_size": {
      "currency": "RUB",
      "period": "2026",
      "tam": {"value": 12400000000, "label": "Весь релевантный рынок", "formula": "Количество покупателей × средний бюджет", "assumptions": ["Базовый спрос"], "source_ids": ["S1"]},
      "sam": {"value": 2100000000, "label": "Доступный рынок", "formula": "TAM × географический и продуктовый фильтры", "assumptions": ["Целевая география"], "source_ids": ["S1"]},
      "som": {"value": 48000000, "label": "Достижимый рынок", "formula": "Производственная мощность × средний чек", "assumptions": ["Горизонт 3 года"], "source_ids": ["S2"]},
      "scenarios": [
        {"name": "Консервативный", "tam": 10000000000, "sam": 1600000000, "som": 24000000, "assumptions": ["Низкий темп роста"]},
        {"name": "Базовый", "tam": 12400000000, "sam": 2100000000, "som": 48000000, "assumptions": ["Средний темп роста"]},
        {"name": "Оптимистичный", "tam": 15000000000, "sam": 2800000000, "som": 72000000, "assumptions": ["Успешное масштабирование"]}
      ]
    },
    "pestel": [{"label": "Экономика", "items": ["Чувствительность к стоимости финансирования"]}],
    "porter": [{"label": "Конкуренция", "items": ["Высокая фрагментация рынка"]}]
  },
  "trends": [
    {"name": "Комплексные решения", "direction": "up", "description": "Клиенты стремятся сокращать число подрядчиков.", "impact": "Возможность усилить единый оффер.", "horizon": "1–3 года", "source_ids": ["S1"]},
    {"name": "Прозрачность расчёта", "direction": "up", "description": "Растёт ожидание быстрого предварительного расчёта.", "impact": "Нужна стандартизация первого предложения.", "horizon": "1–2 года", "source_ids": ["S2"]}
  ],
  "competitors": {
    "summary": "Рынок разделён между узкими специалистами и интеграторами.",
    "items": [
      {"name": "Конкурент A", "type": "Прямой", "website": "https://example.com", "product": "Комплексное решение", "price": "Средний+", "offer": "Быстрый запуск", "positioning": "Интегратор", "strengths": ["Портфолио"], "weaknesses": ["Непрозрачная цена"], "channels": ["SEO", "Партнёры"], "source_ids": ["S2"]},
      {"name": "Конкурент B", "type": "Косвенный", "website": "https://example.org", "product": "Узкая услуга", "price": "Средний", "offer": "Специализация", "positioning": "Нишевой эксперт", "strengths": ["Глубокая экспертиза"], "weaknesses": ["Ограниченный ассортимент"], "channels": ["Контент"], "source_ids": ["S2"]}
    ],
    "white_spaces": ["Единая ответственность", "Прозрачный маршрут проекта", "Быстрый расчёт"]
  },
  "audiences": [
    {"name": "Сегмент A", "priority": "high", "description": "Клиенты со сложной задачей и высокой стоимостью ошибки.", "situation": "Проект переходит к реализации.", "jtbd": "Когда проект переходит к реализации, хочу одного ответственного партнёра, чтобы снизить риски.", "pains": ["Срывы сроков", "Разрозненные подрядчики"], "motives": ["Контроль", "Предсказуемость"], "triggers": ["Утверждение проекта"], "barriers": ["Недоверие"], "criteria": ["Кейсы", "Срок", "Прозрачность"], "decision_roles": ["Инициатор", "ЛПР", "Согласующий"], "channels": ["Партнёры", "Поиск"]}
  ],
  "cjm": [
    {"stage": "Потребность", "actions": ["Формулирует задачу"], "questions": ["К кому обратиться?"], "barriers": ["Неясный процесс"], "touchpoints": ["Рекомендации", "Поиск"], "opportunities": ["Объяснить маршрут проекта"]},
    {"stage": "Сравнение", "actions": ["Запрашивает расчёты"], "questions": ["Кто надёжнее?"], "barriers": ["Несопоставимые предложения"], "touchpoints": ["Сайт", "Коммерческое предложение"], "opportunities": ["Стандартизировать предложение"]}
  ],
  "value_proposition": {
    "customer_jobs": ["Реализовать проект", "Сократить число подрядчиков"],
    "pains": ["Срывы сроков", "Размытая ответственность"],
    "gains": ["Предсказуемость", "Единая коммуникация"],
    "products_services": ["Комплексное сопровождение"],
    "pain_relievers": ["Единый ответственный", "Контрольные точки"],
    "gain_creators": ["Быстрый расчёт", "Прозрачный маршрут"]
  },
  "positioning": {
    "statement": "Единый центр реализации сложных проектов.",
    "category": "Интегратор",
    "target_segment": "Клиенты со сложной задачей",
    "core_value": "Предсказуемая реализация",
    "differentiation": "Единая координация нескольких направлений",
    "proof": ["Кейсы", "Срок расчёта", "Партнёрская сеть"],
    "messages": ["Один маршрут вместо нескольких переписок"]
  },
  "swot": {
    "strengths": ["Гибкость", "Комплексность"],
    "weaknesses": ["Низкая узнаваемость"],
    "opportunities": ["Рост спроса на интеграцию"],
    "threats": ["Ценовая конкуренция"],
    "strategies": {"so": ["Использовать комплексность в партнёрских офферах"], "wo": ["Компенсировать узнаваемость кейсами"], "st": ["Продавать ценность координации"], "wt": ["Стандартизировать контроль партнёров"]}
  },
  "business_model_canvas": {
    "customer_segments": ["Сегмент A"],
    "value_propositions": ["Единая координация", "Быстрый расчёт"],
    "channels": ["Партнёры", "Поиск"],
    "customer_relationships": ["Персональное ведение"],
    "revenue_streams": ["Маржа", "Комиссия"],
    "key_resources": ["Экспертиза", "Партнёрская сеть"],
    "key_activities": ["Расчёт", "Координация", "Контроль"],
    "key_partners": ["Производители", "Дизайнеры"],
    "cost_structure": ["Маркетинг", "Управление проектами", "Подрядчики"]
  },
  "marketing_sales": {
    "channels": [{"name": "Партнёрства", "segment": "A", "priority": "high", "speed": "medium", "cost": "medium", "lead_quality": "high", "rationale": "Доступ к сложным проектам"}],
    "offers": ["Предварительный разбор проекта"],
    "content_directions": ["Кейсы", "Разбор рисков"],
    "hypotheses": [{"hypothesis": "Разбор проекта повысит конверсию.", "basis": "Высокая неопределённость клиента.", "test": "20 целевых контактов.", "metric": "Доля запросов на расчёт.", "success_criterion": "Не менее 20%.", "priority": "high"}]
  },
  "roadmap": {
    "days_30": [{"action": "Упаковать три кейса", "reason": "Снизить барьер доверия", "metric": "3 опубликованных кейса", "owner": "Маркетинг", "resources": "Контент", "priority": "high"}],
    "days_60": [{"action": "Запустить партнёрский тест", "reason": "Проверить канал", "metric": "10 партнёров", "owner": "Продажи", "resources": "Коммерческое предложение", "priority": "high"}],
    "days_90": [{"action": "Пересчитать экономику каналов", "reason": "Выбрать масштабируемую модель", "metric": "CAC и конверсия", "owner": "Руководитель", "resources": "CRM", "priority": "medium"}]
  },
  "assumptions_gaps": {
    "assumptions": ["Средний чек требует подтверждения"],
    "contradictions": [],
    "missing_data": ["Фактическая конверсия", "Маржинальность по продуктам"],
    "risks": ["Зависимость от качества партнёров"]
  },
  "sources": [
    {"id": "S1", "title": "Пример отраслевого отчёта", "organization": "Аналитическая организация", "url": "https://example.com/report", "published_at": "2026-01-15", "accessed_at": "2026-06-09", "geography": "Россия", "supports": ["Ёмкость рынка", "Тренды"], "reliability": "high"},
    {"id": "S2", "title": "Анализ сайтов конкурентов", "organization": "Открытые источники", "url": "https://example.com", "published_at": "", "accessed_at": "2026-06-09", "geography": "Санкт-Петербург", "supports": ["Цены", "Офферы"], "reliability": "medium"}
  ]
}
